<?xml version="1.0" encoding="UTF-8"?>

<options
  xmlns:xsi='http://www.w3.org/2001/XMLSchema-instance'
  xsi:noNamespaceSchemaLocation='question_options_schema.xsd'>
  <scale-identify>
    <clef>treble</clef>
    <tonic>
      <letter>B</letter>
      <accidental>n</accidental>
      <register>2</register>
    </tonic>
    <displaykeysignature>true</displaykeysignature>
    <scaletype>major</scaletype>
    <possiblescalesinresponse>
      <possiblescaletype>major</possiblescaletype>
      <possiblescaletype>natural</possiblescaletype>
      <possiblescaletype>melodic</possiblescaletype>
      <possiblescaletype>pentatonic_major</possiblescaletype>
      <possiblescaletype>pentatonic_minor</possiblescaletype>
      <possiblescaletype>blues</possiblescaletype>
      <possiblescaletype>ionian</possiblescaletype>
      <possiblescaletype>dorian</possiblescaletype>
      <possiblescaletype>phrygian</possiblescaletype>
      <possiblescaletype>mixolydian</possiblescaletype>
      <possiblescaletype>aeolian</possiblescaletype>
      <possiblescaletype>locrian</possiblescaletype>
      <possiblescaletype>chromatic</possiblescaletype>
    </possiblescalesinresponse>
  </scale-identify>
</options>
